data/samples/sample_2025-08-08_VEEA.csv

time,open,high,low,close,volume
09:30,1.4,1.4,1.4,1.4,407
09:54,1.415,1.415,1.415,1.415,200
09:58,1.4006,1.4006,1.4006,1.4006,100
10:08,1.41,1.41,1.41,1.41,100
10:12,1.415,1.415,1.415,1.415,100
10:20,1.42,1.42,1.415,1.415,400
10:34,1.415,1.415,1.365,1.37,12039
10:35,1.36,1.36,1.34,1.34,3665
10:36,1.365,1.365,1.365,1.365,200
10:37,1.4,1.4,1.4,1.4,220
10:39,1.365,1.365,1.365,1.365,300
10:41,1.3405,1.3405,1.32,1.32,3520
10:42,1.35,1.35,1.35,1.35,100
10:44,1.346,1.346,1.346,1.346,200
10:46,1.354,1.354,1.354,1.354,175
10:53,1.3017,1.3017,1.3001,1.3001,350
11:01,1.34,1.34,1.34,1.34,312
11:12,1.37,1.37,1.37,1.37,400
11:16,1.365,1.365,1.365,1.365,510
11:35,1.35,1.35,1.35,1.35,100
11:39,1.35,1.35,1.34,1.34,1946
12:02,1.3687,1.3687,1.3687,1.3687,400
12:12,1.335,1.335,1.335,1.335,210
12:13,1.33,1.33,1.33,1.33,100
12:40,1.36,1.36,1.36,1.36,10000
12:47,1.345,1.345,1.345,1.345,100
12:51,1.33,1.33,1.315,1.315,803
13:20,1.31,1.32,1.31,1.31,2100
13:33,1.31,1.31,1.31,1.31,100
13:34,1.32,1.32,1.32,1.32,100
13:46,1.3,1.3,1.2989,1.2989,12177
14:01,1.29,1.29,1.29,1.29,103
14:18,1.27,1.27,1.27,1.27,315
14:20,1.28,1.3,1.28,1.3,10200
14:21,1.3,1.3,1.3,1.3,10000
15:55,1.29,1.29,1.28,1.28,1207
15:59,1.27,1.27,1.25,1.25,11513

Docs/versions/80. version v0.8.1.0.2 TWCS phase 2 second part/run over 10 days.md

RESULTS:
• Profit/Loss: $-35.00
• This trade lost $35.00.
• Number of shares: 1000
• Entry price: $1.40
• Exit price: $1.36
• Profit per share: $-0.03
• Sale time: 2025-08-01 10:09

RESULTS:
• Profit/Loss: $-34.98
• This trade lost $34.98.
• Number of shares: 1093
• Entry price: $1.28
• Exit price: $1.25
• Profit per share: $-0.03
• Sale time: 2025-08-07 11:29

RESULTS:
• Profit/Loss: $-34.98
• This trade lost $34.98.
• Number of shares: 996
• Entry price: $1.40
• Exit price: $1.37
• Profit per share: $-0.04
• Sale time: 2025-08-08 11:45